{
  "schema": "evaluation-attempt/v1",
  "evaluation_attempt_id": "ea-minimal",
  "case": {"evaluation_case_id": "ec-1", "sha256": "1111111111111111111111111111111111111111111111111111111111111111"},
  "suite": {"suite_id": "suite-1", "sha256": "2222222222222222222222222222222222222222222222222222222222222222"},
  "candidate": {"candidate_id": "candidate-1", "sha256": "3333333333333333333333333333333333333333333333333333333333333333"},
  "envelope": {"envelope_sha256": "4444444444444444444444444444444444444444444444444444444444444444"},
  "runner": {"tool": "fixture-runner", "version": "1.0.0"},
  "scorer": {"level": "oracle", "tool": "fixture-scorer", "version": "1.0.0"},
  "environment": {},
  "execution": {
    "status": "runner_error",
    "attempts": 1,
    "complete_outputs": [],
    "partial_outputs": [],
    "artifacts": [],
    "diagnostics": [{"detail": "Synthetic fixture failure."}]
  },
  "gate_results": [{"gate": "integrity", "result": "fail", "reason": "Synthetic fixture failure."}],
  "verdict": "error",
  "levels_covered": ["L0"],
  "generated_at": "2026-08-24T12:00:00Z"
}
